{
  "$schema": "http://json-schema.org/draft-07/schema#",
  "$id": "https://aumbrye.dev/schemas/enemy-definition.v1.json",
  "title": "EnemyDefinition",
  "description": "Enemy and boss content: base tuning, a non-empty move set, and optional fight phases.",
  "type": "object",
  "additionalProperties": false,
  "required": [
    "id",
    "name",
    "scene",
    "health",
    "poise",
    "move_speed",
    "attack_damage",
    "attack_poise_damage",
    "windup_duration",
    "active_duration",
    "recovery_duration",
    "attack_range",
    "attack_cooldown",
    "stagger_duration",
    "attacks"
  ],
  "definitions": {
    "damageType": {
      "type": "string",
      "enum": ["physical", "fire", "frost", "poison", "lightning", "arcane"]
    },
    "telegraphShape": {
      "type": "string",
      "enum": ["circle", "cone", "line", "ring"]
    },
    "attackClass": {
      "type": "string",
      "enum": ["blockable", "parryable", "unblockable", "grab"]
    },
    "hazardSpawn": {
      "type": "object",
      "additionalProperties": false,
      "required": ["scene"],
      "properties": {
        "scene": { "type": "string", "minLength": 1 },
        "count": { "type": "integer", "minimum": 1, "maximum": 12 },
        "radius": { "type": "number", "exclusiveMinimum": 0 },
        "minRadiusFraction": { "type": "number", "minimum": 0, "maximum": 1 },
        "lifetime": { "type": "number", "exclusiveMinimum": 0 }
      }
    },
    "addSpawn": {
      "type": "object",
      "additionalProperties": false,
      "required": ["enemyId"],
      "properties": {
        "enemyId": { "type": "string", "minLength": 1 },
        "count": { "type": "integer", "minimum": 1, "maximum": 8 },
        "radius": { "type": "number", "exclusiveMinimum": 0 }
      }
    },
    "attack": {
      "type": "object",
      "additionalProperties": false,
      "required": [
        "id",
        "windup_duration",
        "active_duration",
        "recovery_duration",
        "attack_damage"
      ],
      "properties": {
        "id": { "type": "string", "minLength": 1 },
        "translationId": { "type": "string", "minLength": 1 },
        "name": { "type": "string", "minLength": 1 },
        "weight": { "type": "number", "exclusiveMinimum": 0 },
        "min_range": { "type": "number", "minimum": 0 },
        "max_range": { "type": "number", "exclusiveMinimum": 0 },
        "windup_duration": { "type": "number", "minimum": 0 },
        "windup_variance": { "type": "number", "minimum": 0 },
        "active_duration": { "type": "number", "minimum": 0 },
        "recovery_duration": { "type": "number", "minimum": 0 },
        "attack_damage": { "type": "number", "minimum": 0 },
        "attack_poise_damage": { "type": "number", "minimum": 0 },
        "damage_type": { "$ref": "#/definitions/damageType" },
        "status_on_hit": { "type": "string" },
        "status_stacks_on_hit": { "type": "integer", "minimum": 1 },
        "telegraph_radius": { "type": "number", "exclusiveMinimum": 0 },
        "telegraph_shape": { "$ref": "#/definitions/telegraphShape" },
        "telegraph_arc_deg": { "type": "number", "exclusiveMinimum": 0, "maximum": 360 },
        "telegraph_length": { "type": "number", "exclusiveMinimum": 0 },
        "telegraph_width": { "type": "number", "exclusiveMinimum": 0 },
        "telegraph_inner_radius": { "type": "number", "minimum": 0 },
        "attackClass": { "$ref": "#/definitions/attackClass" },
        "anim": {
          "type": "string",
          "enum": [
            "attack_light_1", "attack_light_2", "attack_light_3", "attack_heavy", "attack_thrust",
            "attack_thrust_2", "attack_thrust_3", "attack_shoot", "attack_bite", "attack_shield_bash",
            "attack_slam", "attack_sweep", "attack_grab"
          ]
        },
        "tags": {
          "type": "array",
          "items": { "type": "string", "enum": ["gap_close", "punish_heal", "anti_roll"] },
          "uniqueItems": true
        },
        "hold_fraction": { "type": "number", "minimum": 0, "maximum": 0.6 },
        "feint_chance": { "type": "number", "minimum": 0, "maximum": 0.4 },
        "knockback": { "type": "number", "minimum": 0 },
        "projectile_speed": { "type": "number", "exclusiveMinimum": 0 },
        "projectile_archetype": {
          "type": "string",
          "enum": ["arrow", "bolt_orb", "lobbed_item"]
        },
        "attackBehavior": {
          "type": "string",
          "enum": ["projectile", "melee", "hazard"]
        },
        "lunge_distance": { "type": "number", "minimum": 0 },
        "grab_duration": { "type": "number", "exclusiveMinimum": 0 },
        "grab_drain_per_second": { "type": "number", "minimum": 0 },
        "no_hitbox": { "type": "boolean" },
        "spawn_hazard": { "$ref": "#/definitions/hazardSpawn" },
        "combo_followups": {
          "type": "array",
          "minItems": 1,
          "maxItems": 3,
          "items": { "$ref": "#/definitions/attack" }
        }
      }
    },
    "phase": {
      "type": "object",
      "additionalProperties": false,
      "required": ["id", "hpBelow", "attacks"],
      "properties": {
        "id": { "type": "string", "minLength": 1 },
        "translationId": { "type": "string", "minLength": 1 },
        "name": { "type": "string", "minLength": 1 },
        "hpBelow": { "type": "number", "exclusiveMinimum": 0, "maximum": 1 },
        "attacks": {
          "type": "array",
          "minItems": 1,
          "items": { "$ref": "#/definitions/attack" }
        },
        "moveSpeedMult": { "type": "number", "exclusiveMinimum": 0 },
        "attackCooldownMult": { "type": "number", "exclusiveMinimum": 0 },
        "damageMult": { "type": "number", "exclusiveMinimum": 0 },
        "poiseMult": { "type": "number", "exclusiveMinimum": 0 },
        "cleanseWindows": { "type": "boolean" },
        "ordered": {
          "type": "boolean",
          "description": "BS-01: walk `attacks` in authored order instead of a weighted roll, so the phase can be learned."
        },
        "vulnerability": {
          "type": "object",
          "additionalProperties": false,
          "description": "BS-01: for the duration of this phase, only a procedurally-spawned weak-point Hurtbox takes full damage; the boss's own body Hurtbox is reduced to bodyDamageMult.",
          "properties": {
            "region": { "type": "string", "minLength": 1 },
            "regionDamageMult": { "type": "number", "exclusiveMinimum": 0 },
            "bodyDamageMult": { "type": "number", "minimum": 0, "maximum": 1 },
            "radius": { "type": "number", "exclusiveMinimum": 0 },
            "offset": {
              "type": "array",
              "minItems": 3,
              "maxItems": 3,
              "items": { "type": "number" }
            }
          }
        },
        "onEnter": {
          "type": "object",
          "additionalProperties": false,
          "properties": {
            "tellDuration": { "type": "number", "minimum": 0 },
            "invulnerableFor": { "type": "number", "minimum": 0 },
            "vfx": { "type": "string", "minLength": 1 },
            "sfx": { "type": "string", "minLength": 1 },
            "shake": { "type": "number", "minimum": 0 },
            "telegraphRadius": { "type": "number", "exclusiveMinimum": 0 },
            "telegraphShape": { "$ref": "#/definitions/telegraphShape" },
            "telegraphTint": {
              "type": "array",
              "minItems": 3,
              "maxItems": 3,
              "items": { "type": "number", "minimum": 0, "maximum": 1 }
            },
            "bodyTint": {
              "anyOf": [
                { "type": "string", "pattern": "^#[0-9a-fA-F]{6}$" },
                {
                  "type": "array",
                  "minItems": 3,
                  "maxItems": 3,
                  "items": { "type": "number", "minimum": 0, "maximum": 1 }
                }
              ]
            },
            "emissive": {
              "anyOf": [
                { "type": "string", "pattern": "^#[0-9a-fA-F]{6}$" },
                {
                  "type": "array",
                  "minItems": 3,
                  "maxItems": 4,
                  "items": { "type": "number", "minimum": 0 }
                }
              ]
            },
            "scaleMult": { "type": "number", "exclusiveMinimum": 0 },
            "spawnAdds": {
              "type": "array",
              "minItems": 1,
              "items": { "$ref": "#/definitions/addSpawn" }
            },
            "hazards": {
              "type": "array",
              "minItems": 1,
              "items": { "$ref": "#/definitions/hazardSpawn" }
            },
            "arenaChange": { "$ref": "#/definitions/hazardSpawn" }
          }
        }
      }
    }
  },
  "properties": {
    "id": { "type": "string", "minLength": 1 },
    "name": { "type": "string", "minLength": 1 },
    "title": { "type": "string", "minLength": 1 },
    "loreText": { "type": "string" },
    "description": { "type": "string" },
    "scene": { "type": "string", "minLength": 1 },
    "threat_cost": { "type": "integer", "minimum": 0 },
    "health": { "type": "number", "exclusiveMinimum": 0 },
    "poise": { "type": "number", "minimum": 0 },
    "mass": { "type": "number", "exclusiveMinimum": 0 },
    "move_speed": { "type": "number", "exclusiveMinimum": 0 },
    "attack_damage": { "type": "number", "minimum": 0 },
    "attack_poise_damage": { "type": "number", "minimum": 0 },
    "windup_duration": { "type": "number", "minimum": 0 },
    "windup_variance": { "type": "number", "minimum": 0 },
    "active_duration": { "type": "number", "minimum": 0 },
    "recovery_duration": { "type": "number", "minimum": 0 },
    "attack_range": { "type": "number", "exclusiveMinimum": 0 },
    "attack_cooldown": { "type": "number", "minimum": 0 },
    "attack_token_group": { "type": "string", "minLength": 1 },
    "stagger_duration": { "type": "number", "minimum": 0 },
    "aggro_range": { "type": "number", "exclusiveMinimum": 0 },
    "deaggro_range": { "type": "number", "exclusiveMinimum": 0 },
    "patrol_radius": { "type": "number", "minimum": 0 },
    "preferred_range": { "type": "number", "minimum": 0 },
    "retreat_range": { "type": "number", "minimum": 0 },
    "retreat_threshold": { "type": "number", "minimum": 0, "maximum": 1 },
    "projectile_speed": { "type": "number", "exclusiveMinimum": 0 },
    "projectile_archetype": {
      "type": "string",
      "enum": ["arrow", "bolt_orb", "lobbed_item"]
    },
    "leaps": {
      "type": "object",
      "additionalProperties": false,
      "required": ["range", "windup", "distance", "cooldown"],
      "properties": {
        "range": { "type": "number", "exclusiveMinimum": 0 },
        "windup": { "type": "number", "exclusiveMinimum": 0 },
        "distance": { "type": "number", "minimum": 0 },
        "cooldown": { "type": "number", "exclusiveMinimum": 0 },
        "damage": { "type": "number", "minimum": 0 },
        "poise_damage": { "type": "number", "minimum": 0 },
        "recovery": { "type": "number", "exclusiveMinimum": 0 },
        "attackClass": { "$ref": "#/definitions/attackClass" }
      }
    },
    "block_mitigation": { "type": "number", "minimum": 0, "maximum": 1 },
    "block_reduction": {
      "anyOf": [
        { "type": "number", "minimum": 0, "maximum": 1 },
        {
          "type": "object",
          "additionalProperties": false,
          "properties": {
            "physical": { "type": "number", "minimum": 0, "maximum": 1 },
            "fire": { "type": "number", "minimum": 0, "maximum": 1 },
            "frost": { "type": "number", "minimum": 0, "maximum": 1 },
            "poison": { "type": "number", "minimum": 0, "maximum": 1 },
            "lightning": { "type": "number", "minimum": 0, "maximum": 1 },
            "arcane": { "type": "number", "minimum": 0, "maximum": 1 }
          }
        }
      ]
    },
    "block_angle_deg": { "type": "number", "minimum": 0, "maximum": 180 },
    "vision_cone_deg": { "type": "number", "minimum": 10, "maximum": 360 },
    "hearing_range": { "type": "number", "minimum": 0 },
    "awareness_rate": { "type": "number", "exclusiveMinimum": 0 },
    "awareness_decay": { "type": "number", "minimum": 0 },
    "alert_radius": { "type": "number", "minimum": 0 },
    "circle_radius_mult": { "type": "number", "minimum": 1 },
    "telegraph_radius": { "type": "number", "exclusiveMinimum": 0 },
    "telegraph_shape": { "$ref": "#/definitions/telegraphShape" },
    "telegraph_arc_deg": { "type": "number", "exclusiveMinimum": 0, "maximum": 360 },
    "telegraph_length": { "type": "number", "exclusiveMinimum": 0 },
    "telegraph_width": { "type": "number", "exclusiveMinimum": 0 },
    "telegraph_inner_radius": { "type": "number", "minimum": 0 },
    "attackClass": { "$ref": "#/definitions/attackClass" },
    "voice": { "type": "string" },
    "hold_fraction": { "type": "number", "minimum": 0, "maximum": 0.6 },
    "feint_chance": { "type": "number", "minimum": 0, "maximum": 0.4 },
    "guard_chance": { "type": "number", "minimum": 0, "maximum": 1 },
    "sidestep_chance": { "type": "number", "minimum": 0, "maximum": 1 },
    "punish_window": { "type": "number", "minimum": 0 },
    "weapon_kit": { "type": "string" },
    "coinReward": { "type": "integer", "minimum": 0 },
    "goldReward": { "type": "integer", "minimum": 0 },
    "phase2_threshold": { "type": "number", "minimum": 0, "maximum": 1 },
    "phaseCount": { "type": "integer", "minimum": 1, "default": 1 },
    "isBoss": { "type": "boolean" },
    "isElite": { "type": "boolean" },
    "arenaHalfExtent": { "type": "number", "exclusiveMinimum": 0 },
    "enemy_type": {
      "type": "string",
      "enum": ["melee", "ranged", "shield", "boss"]
    },
    "hit_material": {
      "type": "string",
      "enum": ["flesh", "armour", "stone", "crystal", "bone", "ooze"]
    },
    "damage_type": { "$ref": "#/definitions/damageType" },
    "status_on_hit": { "type": "string" },
    "status_stacks_on_hit": { "type": "integer", "minimum": 1 },
    "resistances": {
      "type": "object",
      "additionalProperties": { "type": "number" }
    },
    "attacks": {
      "type": "array",
      "minItems": 1,
      "description": "Move set. Never empty: an enemy with no attacks falls back to a single flat swing.",
      "items": { "$ref": "#/definitions/attack" }
    },
    "phases": {
      "type": "array",
      "minItems": 2,
      "items": { "$ref": "#/definitions/phase" }
    }
  },
  "if": { "properties": { "isBoss": { "const": true } }, "required": ["isBoss"] },
  "then": { "required": ["phases"] }
}
