{
  "id": "crystal_wisp",
  "name": "Crystal Wisp",
  "scene": "res://scenes/enemies/crystal_wisp.tscn",
  "threat_cost": 20,
  "health": 55,
  "poise": 28,
  "move_speed": 4.5,
  "attack_damage": 34,
  "attack_poise_damage": 10,
  "windup_duration": 0.65,
  "active_duration": 0.15,
  "recovery_duration": 0.85,
  "attack_range": 2.4,
  "attack_cooldown": 1.4,
  "stagger_duration": 1,
  "aggro_range": 10,
  "deaggro_range": 16,
  "patrol_radius": 4,
  "vision_cone_deg": 150,
  "hearing_range": 10,
  "awareness_rate": 2.6,
  "alert_radius": 16,
  "circle_radius_mult": 1.8,
  "enemy_type": "ranged",
  "hit_material": "crystal",
  "weapon_kit": "staff",
  "attacks": [
    {
      "id": "bolt",
      "anim": "attack_shoot",
      "name": "Sent Bolt",
      "weight": 3,
      "windup_duration": 0.59,
      "windup_variance": 0.09,
      "active_duration": 0.15,
      "recovery_duration": 0.85,
      "attack_damage": 28,
      "attack_poise_damage": 8,
      "max_range": 2.4,
      "telegraph_shape": "circle",
      "attackClass": "blockable",
      "knockback": 2.0,
      "tags": [
        "punish_heal"
      ]
    },
    {
      "id": "hex",
      "anim": "attack_shoot",
      "name": "Long Hex",
      "weight": 2,
      "windup_duration": 1.11,
      "windup_variance": 0.22,
      "active_duration": 0.18,
      "recovery_duration": 1.11,
      "attack_damage": 45,
      "attack_poise_damage": 12,
      "max_range": 2.4,
      "telegraph_shape": "circle",
      "attackClass": "unblockable",
      "knockback": 2.0,
      "tags": [
        "anti_roll"
      ]
    },
    {
      "id": "ward_burst",
      "anim": "attack_shoot",
      "name": "Ward Burst",
      "weight": 2,
      "windup_duration": 0.78,
      "windup_variance": 0.12,
      "active_duration": 0.15,
      "recovery_duration": 0.85,
      "attack_damage": 34,
      "attack_poise_damage": 12,
      "max_range": 2.88,
      "telegraph_shape": "ring",
      "attackClass": "parryable",
      "knockback": 2.0,
      "tags": [
        "gap_close"
      ]
    }
  ]
}
