{
  "id": "iron_sentinel",
  "name": "Vault Sentinel",
  "title": "Sealed In Its Post",
  "loreText": "It was told to hold the line and never told the line had moved.",
  "scene": "res://scenes/enemies/iron_sentinel.tscn",
  "threat_cost": 47,
  "health": 155,
  "poise": 101,
  "move_speed": 3,
  "attack_damage": 32,
  "attack_poise_damage": 23,
  "windup_duration": 0.75,
  "active_duration": 0.18,
  "recovery_duration": 1,
  "attack_range": 2.2,
  "attack_cooldown": 1.8,
  "stagger_duration": 1.1,
  "aggro_range": 10,
  "deaggro_range": 16,
  "patrol_radius": 3,
  "block_mitigation": 0.85,
  "block_reduction": {
    "physical": 0.85,
    "fire": 0.4,
    "frost": 0.4,
    "poison": 0.4,
    "lightning": 0.4,
    "arcane": 0.4
  },
  "block_angle_deg": 95,
  "vision_cone_deg": 95,
  "hearing_range": 8,
  "awareness_rate": 2,
  "alert_radius": 14,
  "circle_radius_mult": 1.15,
  "enemy_type": "shield",
  "hit_material": "armour",
  "weapon_kit": "shield",
  "attacks": [
    {
      "id": "bash",
      "anim": "attack_heavy",
      "name": "Shield Bash",
      "weight": 3,
      "windup_duration": 0.64,
      "windup_variance": 0.07,
      "active_duration": 0.18,
      "recovery_duration": 1,
      "attack_damage": 25,
      "attack_poise_damage": 35,
      "max_range": 2.2,
      "telegraph_shape": "circle",
      "attackClass": "blockable",
      "knockback": 3.0,
      "tags": [
        "punish_heal"
      ]
    },
    {
      "id": "guard_thrust",
      "anim": "attack_thrust",
      "name": "Guarded Thrust",
      "weight": 2,
      "windup_duration": 0.98,
      "windup_variance": 0.11,
      "active_duration": 0.18,
      "recovery_duration": 1,
      "attack_damage": 40,
      "attack_poise_damage": 25,
      "max_range": 2.86,
      "telegraph_shape": "line",
      "attackClass": "blockable",
      "knockback": 2.5
    },
    {
      "id": "shove",
      "anim": "attack_heavy",
      "name": "Shove",
      "weight": 2,
      "windup_duration": 1.16,
      "windup_variance": 0.18,
      "active_duration": 0.18,
      "recovery_duration": 1,
      "attack_damage": 19,
      "attack_poise_damage": 44,
      "max_range": 2.2,
      "telegraph_shape": "circle",
      "combo_followups": [
        {
          "id": "shove_punish",
          "name": "Following Chop",
          "weight": 1,
          "windup_duration": 0.34,
          "windup_variance": 0.05,
          "active_duration": 0.18,
          "recovery_duration": 1.3,
          "attack_damage": 23,
          "attack_poise_damage": 28,
          "max_range": 2.2,
          "telegraph_shape": "cone",
          "attackClass": "unblockable",
          "knockback": 3.0
        }
      ],
      "attackClass": "unblockable",
      "knockback": 3.5,
      "tags": [
        "anti_roll"
      ],
      "hold_fraction": 0.35
    },
    {
      "id": "sig_press",
      "anim": "attack_heavy",
      "name": "The Press",
      "weight": 1.3,
      "windup_duration": 1.0,
      "windup_variance": 0.1,
      "active_duration": 0.18,
      "recovery_duration": 0.5,
      "attack_damage": 74,
      "attack_poise_damage": 62,
      "max_range": 3.4,
      "telegraph_shape": "circle",
      "damage_type": "physical",
      "combo_followups": [
        {
          "id": "sig_press_wave",
          "name": "The Press (shock)",
          "weight": 1,
          "windup_duration": 0.3,
          "active_duration": 0.2,
          "recovery_duration": 1.35,
          "attack_damage": 30,
          "attack_poise_damage": 34,
          "max_range": 5.5,
          "telegraph_shape": "ring",
          "damage_type": "physical",
          "attackClass": "unblockable",
          "knockback": 3.0
        }
      ],
      "attackClass": "parryable",
      "knockback": 3.5,
      "tags": [
        "gap_close"
      ]
    }
  ],
  "guard_chance": 0.45,
  "sidestep_chance": 0.1,
  "punish_window": 1.1
}
