{
  "id": "crystal_slime",
  "name": "Crystal Slime",
  "scene": "res://scenes/enemies/crystal_slime.tscn",
  "threat_cost": 18,
  "health": 75,
  "poise": 35,
  "move_speed": 3.8,
  "attack_damage": 39,
  "attack_poise_damage": 12,
  "windup_duration": 0.6,
  "active_duration": 0.14,
  "recovery_duration": 0.8,
  "attack_range": 2.2,
  "attack_cooldown": 1.3,
  "stagger_duration": 0.9,
  "aggro_range": 10,
  "deaggro_range": 15,
  "patrol_radius": 4,
  "vision_cone_deg": 170,
  "hearing_range": 13,
  "awareness_rate": 3.2,
  "alert_radius": 15,
  "circle_radius_mult": 1.6,
  "enemy_type": "melee",
  "hit_material": "ooze",
  "resistances": {
    "frost": -0.5,
    "physical": 0.1
  },
  "attacks": [
    {
      "id": "snap",
      "anim": "attack_light_1",
      "name": "Snap",
      "weight": 3,
      "windup_duration": 0.35,
      "windup_variance": 0.05,
      "active_duration": 0.14,
      "recovery_duration": 0.68,
      "attack_damage": 31,
      "attack_poise_damage": 8,
      "max_range": 2.09,
      "telegraph_shape": "circle",
      "attackClass": "blockable",
      "knockback": 2.0,
      "tags": [
        "punish_heal"
      ]
    },
    {
      "id": "lunge",
      "anim": "attack_thrust",
      "name": "Lunge",
      "weight": 2,
      "windup_duration": 0.81,
      "windup_variance": 0.16,
      "active_duration": 0.18,
      "recovery_duration": 0.96,
      "attack_damage": 48,
      "attack_poise_damage": 14,
      "max_range": 4.18,
      "telegraph_shape": "line",
      "attackClass": "parryable",
      "knockback": 2.0
    },
    {
      "id": "worry",
      "anim": "attack_light_1",
      "name": "Worry",
      "weight": 2,
      "windup_duration": 0.43,
      "windup_variance": 0.06,
      "active_duration": 0.14,
      "recovery_duration": 0.8,
      "attack_damage": 28,
      "attack_poise_damage": 8,
      "max_range": 2.2,
      "telegraph_shape": "circle",
      "combo_followups": [
        {
          "id": "worry_two",
          "name": "Second Bite",
          "weight": 1,
          "windup_duration": 0.24,
          "windup_variance": 0.04,
          "active_duration": 0.14,
          "recovery_duration": 0.8,
          "attack_damage": 10,
          "attack_poise_damage": 8,
          "max_range": 2.2,
          "telegraph_shape": "circle",
          "attackClass": "blockable",
          "knockback": 2.0
        },
        {
          "id": "worry_three",
          "name": "Last Bite",
          "weight": 1,
          "windup_duration": 0.25,
          "windup_variance": 0.05,
          "active_duration": 0.14,
          "recovery_duration": 1.08,
          "attack_damage": 13,
          "attack_poise_damage": 11,
          "max_range": 2.2,
          "telegraph_shape": "circle",
          "attackClass": "blockable",
          "knockback": 2.0
        }
      ],
      "attackClass": "blockable",
      "knockback": 2.0,
      "hold_fraction": 0.3,
      "feint_chance": 0.2
    },
    {
      "id": "shard_bloom",
      "anim": "attack_slam",
      "name": "Shard Bloom",
      "weight": 0.6,
      "windup_duration": 1.0,
      "active_duration": 0.14,
      "recovery_duration": 1.0,
      "attack_damage": 0,
      "attack_poise_damage": 0,
      "min_range": 3.0,
      "max_range": 7.0,
      "telegraph_shape": "line",
      "attackClass": "unblockable",
      "attackBehavior": "hazard",
      "no_hitbox": true,
      "spawn_hazard": {
        "scene": "res://scenes/bosses/crystal_pillar_hazard.tscn",
        "count": 3,
        "radius": 4.5,
        "minRadiusFraction": 0.8,
        "lifetime": 4.8
      },
      "tags": [
        "gap_close",
        "anti_roll"
      ]
    }
  ]
}
