{
  "id": "iron_ratchet",
  "name": "Ratchet Servitor",
  "loreText": "Wound tight by a hand that has long since rusted away.",
  "scene": "res://scenes/enemies/iron_ratchet.tscn",
  "threat_cost": 30,
  "health": 122,
  "poise": 61,
  "move_speed": 3.5,
  "attack_damage": 37,
  "attack_poise_damage": 19,
  "windup_duration": 0.65,
  "active_duration": 0.15,
  "recovery_duration": 0.55,
  "attack_range": 2.4,
  "attack_cooldown": 1,
  "stagger_duration": 1,
  "aggro_range": 11,
  "deaggro_range": 17,
  "patrol_radius": 4,
  "vision_cone_deg": 140,
  "hearing_range": 9,
  "awareness_rate": 2.4,
  "alert_radius": 13,
  "enemy_type": "melee",
  "hit_material": "armour",
  "weapon_kit": "axe",
  "attacks": [
    {
      "id": "jab",
      "anim": "attack_light_1",
      "name": "Short Thrust",
      "weight": 3,
      "windup_duration": 0.44,
      "windup_variance": 0.07,
      "active_duration": 0.15,
      "recovery_duration": 0.47,
      "attack_damage": 30,
      "attack_poise_damage": 16,
      "max_range": 2.4,
      "telegraph_shape": "circle",
      "attackClass": "blockable",
      "knockback": 2.5,
      "tags": [
        "punish_heal"
      ]
    },
    {
      "id": "overhead",
      "anim": "attack_sweep",
      "name": "Overhead Cleave",
      "weight": 2,
      "windup_duration": 1.04,
      "windup_variance": 0.14,
      "active_duration": 0.18,
      "recovery_duration": 0.74,
      "attack_damage": 54,
      "attack_poise_damage": 29,
      "max_range": 2.52,
      "telegraph_shape": "cone",
      "attackClass": "unblockable",
      "knockback": 3.0,
      "tags": [
        "gap_close",
        "anti_roll"
      ],
      "hold_fraction": 0.35
    },
    {
      "id": "opening_cut",
      "anim": "attack_light_3",
      "name": "Opening Cut",
      "weight": 2,
      "windup_duration": 0.62,
      "windup_variance": 0.09,
      "active_duration": 0.15,
      "recovery_duration": 0.55,
      "attack_damage": 32,
      "attack_poise_damage": 17,
      "max_range": 2.4,
      "telegraph_shape": "circle",
      "combo_followups": [
        {
          "id": "closing_cut",
          "name": "Closing Cut",
          "weight": 1,
          "windup_duration": 0.33,
          "windup_variance": 0.05,
          "active_duration": 0.15,
          "recovery_duration": 0.69,
          "attack_damage": 21,
          "attack_poise_damage": 20,
          "max_range": 2.4,
          "telegraph_shape": "cone",
          "attackClass": "unblockable",
          "knockback": 2.5
        }
      ],
      "attackClass": "parryable",
      "knockback": 2.5
    }
  ]
}
