{
  "id": "swamp_witch",
  "name": "Swamp Witch",
  "scene": "res://scenes/enemies/swamp_witch.tscn",
  "threat_cost": 30,
  "health": 72,
  "poise": 28,
  "move_speed": 3,
  "attack_damage": 31,
  "attack_poise_damage": 9,
  "windup_duration": 0.85,
  "active_duration": 0.05,
  "recovery_duration": 1.05,
  "attack_range": 13,
  "attack_cooldown": 1.6,
  "stagger_duration": 0.9,
  "aggro_range": 15,
  "deaggro_range": 21,
  "patrol_radius": 3,
  "preferred_range": 10,
  "retreat_range": 6,
  "projectile_speed": 10,
  "vision_cone_deg": 150,
  "hearing_range": 10,
  "awareness_rate": 2.6,
  "alert_radius": 16,
  "circle_radius_mult": 1.8,
  "enemy_type": "ranged",
  "hit_material": "flesh",
  "weapon_kit": "staff",
  "damage_type": "poison",
  "status_on_hit": "poison",
  "status_stacks_on_hit": 1,
  "resistances": {
    "poison": 0.65
  },
  "attacks": [
    {
      "id": "bolt",
      "anim": "attack_shoot",
      "name": "Sent Bolt",
      "weight": 3,
      "windup_duration": 0.77,
      "windup_variance": 0.09,
      "active_duration": 0.05,
      "recovery_duration": 1.05,
      "attack_damage": 26,
      "attack_poise_damage": 7,
      "max_range": 2.8,
      "telegraph_shape": "circle",
      "damage_type": "poison",
      "status_on_hit": "poison",
      "status_stacks_on_hit": 1,
      "attackClass": "blockable",
      "knockback": 2.0,
      "tags": [
        "punish_heal"
      ]
    },
    {
      "id": "hex",
      "anim": "attack_shoot",
      "name": "Long Hex",
      "weight": 2,
      "windup_duration": 1.44,
      "windup_variance": 0.22,
      "active_duration": 0.06,
      "recovery_duration": 1.37,
      "attack_damage": 41,
      "attack_poise_damage": 11,
      "max_range": 2.8,
      "telegraph_shape": "circle",
      "damage_type": "poison",
      "status_on_hit": "poison",
      "status_stacks_on_hit": 1,
      "attackClass": "unblockable",
      "knockback": 2.0,
      "tags": [
        "anti_roll"
      ]
    },
    {
      "id": "ward_burst",
      "anim": "attack_shoot",
      "name": "Ward Burst",
      "weight": 2,
      "windup_duration": 1.02,
      "windup_variance": 0.12,
      "active_duration": 0.05,
      "recovery_duration": 1.05,
      "attack_damage": 31,
      "attack_poise_damage": 10,
      "attackBehavior": "hazard",
      "no_hitbox": true,
      "spawn_hazard": {
        "scene": "res://scenes/traps/poison_pool.tscn",
        "count": 1,
        "radius": 1,
        "lifetime": 5
      },
      "max_range": 3.36,
      "telegraph_shape": "ring",
      "damage_type": "poison",
      "status_on_hit": "poison",
      "status_stacks_on_hit": 1,
      "attackClass": "parryable",
      "knockback": 2.0,
      "tags": [
        "gap_close"
      ]
    }
  ]
}
