{
  "id": "castle_archer",
  "name": "Castle Archer",
  "scene": "res://scenes/enemies/castle_archer.tscn",
  "threat_cost": 25,
  "health": 70,
  "poise": 30,
  "move_speed": 3,
  "attack_damage": 26,
  "attack_poise_damage": 8,
  "windup_duration": 0.9,
  "active_duration": 0.05,
  "recovery_duration": 1.1,
  "attack_range": 14,
  "attack_cooldown": 1.5,
  "stagger_duration": 0.9,
  "aggro_range": 16,
  "deaggro_range": 22,
  "patrol_radius": 3,
  "preferred_range": 10,
  "retreat_range": 6,
  "projectile_speed": 12,
  "vision_cone_deg": 130,
  "hearing_range": 10,
  "awareness_rate": 2.8,
  "alert_radius": 16,
  "enemy_type": "ranged",
  "hit_material": "flesh",
  "weapon_kit": "bow",
  "attacks": [
    {
      "id": "quick_shot",
      "anim": "attack_shoot",
      "name": "Quick Shot",
      "weight": 3,
      "windup_duration": 0.63,
      "windup_variance": 0.09,
      "active_duration": 0.05,
      "recovery_duration": 1.1,
      "attack_damage": 22,
      "attack_poise_damage": 7,
      "max_range": 14,
      "telegraph_shape": "line",
      "no_hitbox": true,
      "projectile_speed": 14,
      "attackClass": "parryable",
      "knockback": 2.0
    },
    {
      "id": "aimed_shot",
      "anim": "attack_shoot",
      "name": "Aimed Shot",
      "weight": 2,
      "windup_duration": 1.05,
      "windup_variance": 0.15,
      "active_duration": 0.05,
      "recovery_duration": 1.38,
      "attack_damage": 42,
      "attack_poise_damage": 11,
      "min_range": 6.3,
      "max_range": 14,
      "telegraph_shape": "line",
      "no_hitbox": true,
      "projectile_speed": 19,
      "attackClass": "unblockable",
      "knockback": 2.0,
      "tags": [
        "anti_roll"
      ]
    },
    {
      "id": "snap_shot",
      "anim": "attack_shoot",
      "name": "Snap Shot",
      "weight": 2,
      "windup_duration": 0.41,
      "windup_variance": 0.05,
      "active_duration": 0.05,
      "recovery_duration": 0.99,
      "attack_damage": 15,
      "attack_poise_damage": 5,
      "max_range": 14,
      "telegraph_shape": "line",
      "no_hitbox": true,
      "projectile_speed": 12,
      "attackClass": "blockable",
      "knockback": 2.0,
      "tags": [
        "punish_heal"
      ]
    }
  ]
}
