{
  "id": "glacial_pilgrim",
  "name": "Frozen Pilgrim",
  "loreText": "It kept walking toward a shrine that the ice took first.",
  "scene": "res://scenes/enemies/glacial_pilgrim.tscn",
  "threat_cost": 40,
  "health": 162,
  "poise": 81,
  "move_speed": 3.5,
  "attack_damage": 37,
  "attack_poise_damage": 25,
  "windup_duration": 0.65,
  "active_duration": 0.15,
  "recovery_duration": 0.55,
  "attack_range": 2.4,
  "attack_cooldown": 1,
  "stagger_duration": 1,
  "aggro_range": 11,
  "deaggro_range": 17,
  "patrol_radius": 4,
  "vision_cone_deg": 140,
  "hearing_range": 9,
  "awareness_rate": 2.4,
  "alert_radius": 13,
  "enemy_type": "melee",
  "hit_material": "flesh",
  "weapon_kit": "spear",
  "damage_type": "frost",
  "status_on_hit": "freeze",
  "attacks": [
    {
      "id": "jab",
      "anim": "attack_light_1",
      "name": "Short Thrust",
      "weight": 3,
      "windup_duration": 0.44,
      "windup_variance": 0.07,
      "active_duration": 0.15,
      "recovery_duration": 0.47,
      "attack_damage": 29,
      "attack_poise_damage": 21,
      "max_range": 2.4,
      "telegraph_shape": "circle",
      "damage_type": "frost",
      "status_on_hit": "freeze",
      "status_stacks_on_hit": 1,
      "attackClass": "blockable",
      "knockback": 2.5,
      "tags": [
        "punish_heal"
      ]
    },
    {
      "id": "overhead",
      "anim": "attack_sweep",
      "name": "Overhead Cleave",
      "weight": 2,
      "windup_duration": 1.04,
      "windup_variance": 0.14,
      "active_duration": 0.18,
      "recovery_duration": 0.74,
      "attack_damage": 53,
      "attack_poise_damage": 39,
      "max_range": 2.52,
      "telegraph_shape": "cone",
      "damage_type": "frost",
      "status_on_hit": "freeze",
      "status_stacks_on_hit": 1,
      "attackClass": "parryable",
      "knockback": 3.0,
      "hold_fraction": 0.3,
      "feint_chance": 0.2
    },
    {
      "id": "opening_cut",
      "anim": "attack_light_3",
      "name": "Opening Cut",
      "weight": 2,
      "windup_duration": 0.62,
      "windup_variance": 0.09,
      "active_duration": 0.15,
      "recovery_duration": 0.55,
      "attack_damage": 32,
      "attack_poise_damage": 23,
      "max_range": 2.4,
      "telegraph_shape": "circle",
      "damage_type": "frost",
      "status_on_hit": "freeze",
      "status_stacks_on_hit": 1,
      "combo_followups": [
        {
          "id": "closing_cut",
          "name": "Closing Cut",
          "weight": 1,
          "windup_duration": 0.33,
          "windup_variance": 0.05,
          "active_duration": 0.15,
          "recovery_duration": 0.69,
          "attack_damage": 28,
          "attack_poise_damage": 26,
          "max_range": 2.4,
          "telegraph_shape": "cone",
          "damage_type": "frost",
          "status_on_hit": "freeze",
          "status_stacks_on_hit": 1,
          "attackClass": "unblockable",
          "knockback": 3.0
        }
      ],
      "attackClass": "blockable",
      "knockback": 2.5
    },
    {
      "id": "sig_keening",
      "anim": "attack_thrust_3",
      "name": "Keening",
      "weight": 1.2,
      "windup_duration": 1.5,
      "windup_variance": 0.18,
      "active_duration": 0.2,
      "recovery_duration": 1.3,
      "attack_damage": 48,
      "attack_poise_damage": 28,
      "min_range": 3.5,
      "max_range": 7.5,
      "telegraph_shape": "line",
      "damage_type": "frost",
      "status_on_hit": "freeze",
      "status_stacks_on_hit": 2,
      "attackClass": "unblockable",
      "knockback": 3.0,
      "tags": [
        "gap_close",
        "anti_roll"
      ]
    }
  ]
}
