{
  "id": "glacial_keener",
  "name": "Hollow Keener",
  "loreText": "It mourns in a language the cold has worn smooth.",
  "scene": "res://scenes/enemies/glacial_keener.tscn",
  "threat_cost": 47,
  "health": 130,
  "poise": 58,
  "move_speed": 3.1,
  "attack_damage": 34,
  "attack_poise_damage": 22,
  "windup_duration": 0.8,
  "active_duration": 0.14,
  "recovery_duration": 0.95,
  "attack_range": 2.6,
  "attack_cooldown": 1.6,
  "stagger_duration": 0.9,
  "aggro_range": 13,
  "deaggro_range": 19,
  "patrol_radius": 4,
  "preferred_range": 9,
  "retreat_range": 5,
  "vision_cone_deg": 150,
  "hearing_range": 10,
  "awareness_rate": 2.6,
  "alert_radius": 16,
  "circle_radius_mult": 1.8,
  "enemy_type": "ranged",
  "hit_material": "flesh",
  "weapon_kit": "staff",
  "damage_type": "frost",
  "status_on_hit": "freeze",
  "attacks": [
    {
      "id": "bolt",
      "anim": "attack_shoot",
      "name": "Sent Bolt",
      "weight": 3,
      "windup_duration": 0.72,
      "windup_variance": 0.09,
      "active_duration": 0.14,
      "recovery_duration": 0.95,
      "attack_damage": 29,
      "attack_poise_damage": 18,
      "max_range": 2.6,
      "telegraph_shape": "circle",
      "damage_type": "frost",
      "status_on_hit": "freeze",
      "status_stacks_on_hit": 1,
      "attackClass": "blockable",
      "knockback": 2.5,
      "tags": [
        "punish_heal"
      ]
    },
    {
      "id": "hex",
      "anim": "attack_shoot",
      "name": "Long Hex",
      "weight": 2,
      "windup_duration": 1.36,
      "windup_variance": 0.22,
      "active_duration": 0.17,
      "recovery_duration": 1.23,
      "attack_damage": 44,
      "attack_poise_damage": 26,
      "max_range": 2.6,
      "telegraph_shape": "circle",
      "damage_type": "frost",
      "status_on_hit": "freeze",
      "status_stacks_on_hit": 1,
      "attackClass": "unblockable",
      "knockback": 3.0,
      "tags": [
        "anti_roll"
      ]
    },
    {
      "id": "ward_burst",
      "anim": "attack_shoot",
      "name": "Ward Burst",
      "weight": 2,
      "windup_duration": 0.96,
      "windup_variance": 0.12,
      "active_duration": 0.14,
      "recovery_duration": 0.95,
      "attack_damage": 34,
      "attack_poise_damage": 25,
      "max_range": 3.12,
      "telegraph_shape": "ring",
      "damage_type": "frost",
      "status_on_hit": "freeze",
      "status_stacks_on_hit": 1,
      "attackClass": "parryable",
      "knockback": 2.5,
      "tags": [
        "gap_close"
      ]
    }
  ]
}
