{
  "id": "venom_drifter",
  "name": "Mire Drifter",
  "loreText": "It goes where the water goes, and the water is patient.",
  "scene": "res://scenes/enemies/venom_drifter.tscn",
  "threat_cost": 12,
  "health": 52,
  "poise": 50,
  "move_speed": 4.6,
  "attack_damage": 29,
  "attack_poise_damage": 18,
  "windup_duration": 0.55,
  "active_duration": 0.12,
  "recovery_duration": 0.7,
  "attack_range": 2.1,
  "attack_cooldown": 1.1,
  "stagger_duration": 0.8,
  "aggro_range": 13,
  "deaggro_range": 19,
  "patrol_radius": 6,
  "vision_cone_deg": 170,
  "hearing_range": 13,
  "awareness_rate": 3.2,
  "alert_radius": 15,
  "circle_radius_mult": 1.6,
  "enemy_type": "melee",
  "hit_material": "ooze",
  "damage_type": "poison",
  "status_on_hit": "poison",
  "status_stacks_on_hit": 1,
  "attacks": [
    {
      "id": "snap",
      "anim": "attack_light_1",
      "name": "Snap",
      "weight": 3,
      "windup_duration": 0.32,
      "windup_variance": 0.05,
      "active_duration": 0.12,
      "recovery_duration": 0.6,
      "attack_damage": 22,
      "attack_poise_damage": 13,
      "max_range": 2,
      "telegraph_shape": "circle",
      "damage_type": "poison",
      "status_on_hit": "poison",
      "status_stacks_on_hit": 1,
      "attackClass": "blockable",
      "knockback": 2.0,
      "tags": [
        "punish_heal"
      ]
    },
    {
      "id": "lunge",
      "anim": "attack_thrust",
      "name": "Lunge",
      "weight": 2,
      "windup_duration": 0.74,
      "windup_variance": 0.16,
      "active_duration": 0.15,
      "recovery_duration": 0.84,
      "attack_damage": 35,
      "attack_poise_damage": 21,
      "max_range": 3.99,
      "telegraph_shape": "line",
      "damage_type": "poison",
      "status_on_hit": "poison",
      "status_stacks_on_hit": 1,
      "attackClass": "unblockable",
      "knockback": 2.5,
      "tags": [
        "gap_close",
        "anti_roll"
      ]
    },
    {
      "id": "worry",
      "anim": "attack_light_1",
      "name": "Worry",
      "weight": 2,
      "windup_duration": 0.4,
      "windup_variance": 0.06,
      "active_duration": 0.12,
      "recovery_duration": 0.7,
      "attack_damage": 21,
      "attack_poise_damage": 12,
      "max_range": 2.1,
      "telegraph_shape": "circle",
      "damage_type": "poison",
      "status_on_hit": "poison",
      "status_stacks_on_hit": 1,
      "combo_followups": [
        {
          "id": "worry_two",
          "name": "Second Bite",
          "weight": 1,
          "windup_duration": 0.22,
          "windup_variance": 0.04,
          "active_duration": 0.12,
          "recovery_duration": 0.7,
          "attack_damage": 15,
          "attack_poise_damage": 12,
          "max_range": 2.1,
          "telegraph_shape": "circle",
          "damage_type": "poison",
          "status_on_hit": "poison",
          "status_stacks_on_hit": 1,
          "attackClass": "blockable",
          "knockback": 2.0
        },
        {
          "id": "worry_three",
          "name": "Last Bite",
          "weight": 1,
          "windup_duration": 0.23,
          "windup_variance": 0.05,
          "active_duration": 0.12,
          "recovery_duration": 0.95,
          "attack_damage": 19,
          "attack_poise_damage": 16,
          "max_range": 2.1,
          "telegraph_shape": "circle",
          "damage_type": "poison",
          "status_on_hit": "poison",
          "status_stacks_on_hit": 1,
          "attackClass": "blockable",
          "knockback": 2.5
        }
      ],
      "attackClass": "parryable",
      "knockback": 2.0,
      "hold_fraction": 0.3,
      "feint_chance": 0.2
    }
  ]
}
