{
  "id": "iron_bellows_golem",
  "name": "Bellows Golem",
  "loreText": "Still breathing for a forge that has gone cold.",
  "scene": "res://scenes/enemies/iron_bellows_golem.tscn",
  "threat_cost": 54,
  "health": 250,
  "poise": 142,
  "move_speed": 2.8,
  "attack_damage": 45,
  "attack_poise_damage": 31,
  "windup_duration": 0.85,
  "active_duration": 0.2,
  "recovery_duration": 1.1,
  "attack_range": 2.6,
  "attack_cooldown": 1.9,
  "stagger_duration": 1.3,
  "aggro_range": 10,
  "deaggro_range": 16,
  "patrol_radius": 3,
  "vision_cone_deg": 110,
  "hearing_range": 11,
  "awareness_rate": 1.7,
  "alert_radius": 10,
  "circle_radius_mult": 1.2,
  "enemy_type": "melee",
  "hit_material": "stone",
  "weapon_kit": "greatsword",
  "attacks": [
    {
      "id": "hammer",
      "anim": "attack_heavy",
      "name": "Downward Hammer",
      "weight": 3,
      "windup_duration": 0.98,
      "windup_variance": 0.1,
      "active_duration": 0.2,
      "recovery_duration": 1.1,
      "attack_damage": 50,
      "attack_poise_damage": 40,
      "max_range": 2.6,
      "telegraph_shape": "circle",
      "attackClass": "blockable",
      "knockback": 3.5,
      "tags": [
        "punish_heal"
      ]
    },
    {
      "id": "slam",
      "anim": "attack_heavy",
      "name": "Ground Slam",
      "weight": 2,
      "windup_duration": 1.66,
      "windup_variance": 0.2,
      "active_duration": 0.27,
      "recovery_duration": 1.65,
      "attack_damage": 72,
      "attack_poise_damage": 60,
      "max_range": 2.86,
      "telegraph_shape": "circle",
      "attackClass": "unblockable",
      "knockback": 3.5,
      "tags": [
        "anti_roll"
      ],
      "hold_fraction": 0.35
    },
    {
      "id": "held_sweep",
      "anim": "attack_sweep",
      "name": "Held Sweep",
      "weight": 2,
      "windup_duration": 1.27,
      "windup_variance": 0.3,
      "active_duration": 0.24,
      "recovery_duration": 1.43,
      "attack_damage": 59,
      "attack_poise_damage": 48,
      "max_range": 3.64,
      "telegraph_shape": "cone",
      "attackClass": "parryable",
      "knockback": 3.5,
      "tags": [
        "gap_close"
      ]
    },
    {
      "id": "sig_press",
      "anim": "attack_heavy",
      "name": "The Press",
      "weight": 1.3,
      "windup_duration": 1.0,
      "windup_variance": 0.1,
      "active_duration": 0.18,
      "recovery_duration": 0.5,
      "attack_damage": 74,
      "attack_poise_damage": 62,
      "max_range": 3.4,
      "telegraph_shape": "circle",
      "damage_type": "physical",
      "combo_followups": [
        {
          "id": "sig_press_wave",
          "name": "The Press (shock)",
          "weight": 1,
          "windup_duration": 0.3,
          "active_duration": 0.2,
          "recovery_duration": 1.35,
          "attack_damage": 30,
          "attack_poise_damage": 34,
          "max_range": 5.5,
          "telegraph_shape": "ring",
          "damage_type": "physical",
          "attackClass": "unblockable",
          "knockback": 3.0
        }
      ],
      "attackClass": "blockable",
      "knockback": 3.5
    }
  ],
  "mass": 2.8
}
