{
  "id": "crystal_bat",
  "name": "Crystal Bat",
  "scene": "res://scenes/enemies/crystal_bat.tscn",
  "threat_cost": 22,
  "health": 55,
  "poise": 25,
  "move_speed": 4.5,
  "attack_damage": 31,
  "attack_poise_damage": 7,
  "windup_duration": 0.75,
  "active_duration": 0.05,
  "recovery_duration": 1,
  "attack_range": 12,
  "attack_cooldown": 1.4,
  "stagger_duration": 0.8,
  "aggro_range": 14,
  "deaggro_range": 20,
  "patrol_radius": 5,
  "preferred_range": 9,
  "retreat_range": 5,
  "projectile_speed": 13,
  "vision_cone_deg": 170,
  "hearing_range": 13,
  "awareness_rate": 3.2,
  "alert_radius": 15,
  "circle_radius_mult": 1.6,
  "enemy_type": "ranged",
  "hit_material": "crystal",
  "damage_type": "physical",
  "resistances": {
    "physical": 0.15
  },
  "attacks": [
    {
      "id": "snap",
      "anim": "attack_shoot",
      "name": "Snap",
      "weight": 3,
      "windup_duration": 0.43,
      "windup_variance": 0.05,
      "active_duration": 0.05,
      "recovery_duration": 0.85,
      "attack_damage": 23,
      "attack_poise_damage": 5,
      "attackBehavior": "melee",
      "max_range": 2.47,
      "telegraph_shape": "circle",
      "damage_type": "physical",
      "attackClass": "blockable",
      "knockback": 2.0,
      "tags": [
        "punish_heal"
      ]
    },
    {
      "id": "lunge",
      "anim": "attack_shoot",
      "name": "Lunge",
      "weight": 2,
      "windup_duration": 1.01,
      "windup_variance": 0.16,
      "active_duration": 0.06,
      "recovery_duration": 1.2,
      "attack_damage": 37,
      "attack_poise_damage": 8,
      "attackBehavior": "melee",
      "lunge_distance": 3.4,
      "max_range": 4.94,
      "telegraph_shape": "line",
      "damage_type": "physical",
      "attackClass": "unblockable",
      "knockback": 2.0,
      "tags": [
        "gap_close",
        "anti_roll"
      ]
    },
    {
      "id": "worry",
      "anim": "attack_shoot",
      "name": "Worry",
      "weight": 2,
      "windup_duration": 0.54,
      "windup_variance": 0.06,
      "active_duration": 0.05,
      "recovery_duration": 1,
      "attack_damage": 23,
      "attack_poise_damage": 5,
      "attackBehavior": "melee",
      "max_range": 2.6,
      "telegraph_shape": "circle",
      "damage_type": "physical",
      "combo_followups": [
        {
          "id": "worry_two",
          "name": "Second Bite",
          "weight": 1,
          "windup_duration": 0.3,
          "windup_variance": 0.04,
          "active_duration": 0.05,
          "recovery_duration": 1,
          "attack_damage": 8,
          "attack_poise_damage": 5,
          "attackBehavior": "melee",
          "max_range": 12,
          "telegraph_shape": "circle",
          "damage_type": "physical",
          "attackClass": "blockable",
          "knockback": 2.0
        },
        {
          "id": "worry_three",
          "name": "Last Bite",
          "weight": 1,
          "windup_duration": 0.32,
          "windup_variance": 0.05,
          "active_duration": 0.05,
          "recovery_duration": 1.35,
          "attack_damage": 10,
          "attack_poise_damage": 6,
          "attackBehavior": "melee",
          "max_range": 12,
          "telegraph_shape": "circle",
          "damage_type": "physical",
          "attackClass": "blockable",
          "knockback": 2.0
        }
      ],
      "attackClass": "parryable",
      "knockback": 2.0
    }
  ]
}
