{
  "id": "glacial_hollowed",
  "name": "Hollowed Bearer",
  "loreText": "The shield froze to its arm, and then to the rest of it.",
  "scene": "res://scenes/enemies/glacial_hollowed.tscn",
  "threat_cost": 63,
  "health": 207,
  "poise": 135,
  "move_speed": 3,
  "attack_damage": 32,
  "attack_poise_damage": 31,
  "windup_duration": 0.75,
  "active_duration": 0.18,
  "recovery_duration": 1,
  "attack_range": 2.2,
  "attack_cooldown": 1.8,
  "stagger_duration": 1.1,
  "aggro_range": 10,
  "deaggro_range": 16,
  "patrol_radius": 3,
  "block_mitigation": 0.82,
  "block_reduction": {
    "physical": 0.82,
    "fire": 0.35,
    "frost": 0.6,
    "poison": 0.35,
    "lightning": 0.35,
    "arcane": 0.35
  },
  "block_angle_deg": 105,
  "vision_cone_deg": 120,
  "hearing_range": 8,
  "awareness_rate": 2,
  "alert_radius": 14,
  "circle_radius_mult": 1.15,
  "enemy_type": "shield",
  "hit_material": "armour",
  "weapon_kit": "shield",
  "damage_type": "frost",
  "status_on_hit": "freeze",
  "attacks": [
    {
      "id": "bash",
      "anim": "attack_heavy",
      "name": "Shield Bash",
      "weight": 3,
      "windup_duration": 0.64,
      "windup_variance": 0.07,
      "active_duration": 0.18,
      "recovery_duration": 1,
      "attack_damage": 25,
      "attack_poise_damage": 47,
      "max_range": 2.2,
      "telegraph_shape": "circle",
      "damage_type": "frost",
      "status_on_hit": "freeze",
      "status_stacks_on_hit": 1,
      "attackClass": "blockable",
      "knockback": 3.5,
      "tags": [
        "punish_heal"
      ]
    },
    {
      "id": "guard_thrust",
      "anim": "attack_thrust_3",
      "name": "Guarded Thrust",
      "weight": 2,
      "windup_duration": 0.98,
      "windup_variance": 0.11,
      "active_duration": 0.18,
      "recovery_duration": 1,
      "attack_damage": 39,
      "attack_poise_damage": 34,
      "max_range": 2.86,
      "telegraph_shape": "line",
      "damage_type": "frost",
      "status_on_hit": "freeze",
      "status_stacks_on_hit": 1,
      "attackClass": "blockable",
      "knockback": 3.0
    },
    {
      "id": "shove",
      "anim": "attack_heavy",
      "name": "Shove",
      "weight": 2,
      "windup_duration": 1.16,
      "windup_variance": 0.18,
      "active_duration": 0.18,
      "recovery_duration": 1,
      "attack_damage": 19,
      "attack_poise_damage": 59,
      "max_range": 2.2,
      "telegraph_shape": "circle",
      "damage_type": "frost",
      "status_on_hit": "freeze",
      "status_stacks_on_hit": 1,
      "combo_followups": [
        {
          "id": "shove_punish",
          "name": "Following Chop",
          "weight": 1,
          "windup_duration": 0.34,
          "windup_variance": 0.05,
          "active_duration": 0.18,
          "recovery_duration": 1.3,
          "attack_damage": 30,
          "attack_poise_damage": 37,
          "max_range": 2.2,
          "telegraph_shape": "cone",
          "damage_type": "frost",
          "status_on_hit": "freeze",
          "status_stacks_on_hit": 1,
          "attackClass": "unblockable",
          "knockback": 3.0
        }
      ],
      "attackClass": "parryable",
      "knockback": 3.5,
      "hold_fraction": 0.3,
      "feint_chance": 0.2
    },
    {
      "id": "sig_keening",
      "anim": "attack_thrust_3",
      "name": "Keening",
      "weight": 1.2,
      "windup_duration": 1.5,
      "windup_variance": 0.18,
      "active_duration": 0.2,
      "recovery_duration": 1.3,
      "attack_damage": 48,
      "attack_poise_damage": 28,
      "min_range": 3.5,
      "max_range": 7.5,
      "telegraph_shape": "line",
      "damage_type": "frost",
      "status_on_hit": "freeze",
      "status_stacks_on_hit": 2,
      "attackClass": "unblockable",
      "knockback": 3.0,
      "tags": [
        "gap_close",
        "anti_roll"
      ]
    }
  ],
  "guard_chance": 0.4,
  "sidestep_chance": 0.1,
  "punish_window": 1.0
}
